{
  "schemaVersion": "dsh-oidc/v1alpha1",
  "id": "ecnu",
  "displayName": "华东师范大学 ChatECNU",
  "organization": "华东师范大学",
  "brand": {
    "productName": "EduWork@ECNU",
    "organizationName": "华东师范大学",
    "mark": "华",
    "primaryColor": "#9f2636",
    "loginTitle": "使用华东师范大学统一身份认证",
    "loginDescription": "登录后由学校企业服务为当前用户绑定 ChatECNU 运行凭据；学校密码不会进入 DSH。",
    "supportURL": "https://support.example.edu/replace-me"
  },
  "auth": {
    "discoveryUrl": "https://models.example.org/.well-known/openid-configuration",
    "expectedIssuer": "https://models.example.org",
    "experimentalOidcLlm": true,
    "clientId": "replace-with-public-client-id",
    "identityMode": "oidc"
  },
  "provider": {
    "id": "chatecnu",
    "displayName": "ChatECNU",
    "adapter": "openai-compatible",
    "reasoning": "high",
    "defaultContextWindow": 1000000,
    "defaultMaxTokens": 393216,
    "streamIdleTimeoutMs": 300000,
    "retryPolicy": {
      "mode": "normal",
      "maxRetries": 2
    },
    "compat": {
      "supportsDeveloperRole": false,
      "supportsStore": false,
      "supportsReasoningEffort": true,
      "supportsUsageInStreaming": true,
      "maxTokensField": "max_tokens",
      "supportsStrictMode": false,
      "supportsLongCacheRetention": false,
      "thinkingFormat": "deepseek",
      "requiresReasoningContentOnAssistantMessages": true
    },
    "models": [
      {
        "id": "ecnu-max",
        "type": "llm",
        "name": "ecnu-max",
        "contextWindow": 1000000,
        "maxTokens": 393216,
        "input": [
          "text"
        ],
        "reasoningEfforts": {
          "max": "max",
          "high": "high",
          "low": "low"
        }
      },
      {
        "id": "ecnu-plus",
        "type": "llm",
        "name": "ecnu-plus",
        "contextWindow": 262144,
        "maxTokens": 65536,
        "input": [
          "text",
          "image"
        ],
        "compat": {
          "supportsReasoningEffort": false
        }
      }
    ],
    "modelSource": "discovery"
  },
  "allowInsecureDevelopment": false
}
